"title","type","publisher","journal","month","year","language","booktitle","volume","pages","ee""An Indefinite Preconditioner for KKT Systems Arising in Optimal Control Problems","article","","Universität Trier, Mathematik/Informatik, Forschungsbericht","",2019,"","","00-10","",""
"Logarithmic Barrier Methods for Solving the Optimal Output Feedback Problem","article","","Universität Trier, Mathematik/Informatik, Forschungsbericht","",2012,"","","95-16","",""
"Stochastic Models for Communication Networks with Moving Customers","article","","Universität Trier, Mathematik/Informatik, Forschungsbericht","",1988,"","","01-02","",""
"Computational Complexity of Inner and Outer j-RADII of Polytopes in Finite-Dimensional Normed Spaces","article","","Universität Trier, Mathematik/Informatik, Forschungsbericht","",2017,"","","93-06","",""
"Utility Function Program with or without Explicit Form of Utility Function","article","","Universität Trier, Mathematik/Informatik, Forschungsbericht","",2014,"","","96-45","",""
"Scheduling with Constrained Processor Allocation for Interval Orders","article","","Universität Trier, Mathematik/Informatik, Forschungsbericht","",2021,"","","92-11","",""
"Some Bounds on Multiparty Communication Complexity of Pointer Jumping","article","","Universität Trier, Mathematik/Informatik, Forschungsbericht","",2012,"","","95-17","",""
"An Efficient Method for Aerodynamic Shape Optimization","article","","Universität Trier, Mathematik/Informatik, Forschungsbericht","",2010,"","","04-07","",""
"Zum Gleichgewichtsverhalten von Markov-Prozessen","article","","Universität Trier, Mathematik/Informatik, Forschungsbericht","",2001,"","","98-03","",""
"Scheduling of Conditional Executed Jobs on Unrelated Processors","article","","Universität Trier, Mathematik/Informatik, Forschungsbericht","",2020,"","","93-04","",""
"Constraint Decomposition Algorithms in Global Optimization","article","","Universität Trier, Mathematik/Informatik, Forschungsbericht","",1987,"","","93-15","",""
"How Much ExOR Improves on OR?","article","","Universität Trier, Mathematik/Informatik, Forschungsbericht","",1988,"","","93-07","",""
"A Product Theorem for Markov Chains with Application to PF-Queueing Networks","article","","Universität Trier, Mathematik/Informatik, Forschungsbericht","",2016,"","","01-11","",""
"Zur Berechnung optimaler Steuerungen über Momentenungleichungen","article","","Universität Trier, Mathematik/Informatik, Forschungsbericht","",1999,"","","00-04","",""
"On the Distribution of càdlàg Processes without Explosions","article","","Universität Trier, Mathematik/Informatik, Forschungsbericht","",2009,"","","02-02","",""
"On Optimization Properties of Functions with a Concave Minorant","article","","Universität Trier, Mathematik/Informatik, Forschungsbericht","",2001,"spanish","","97-11","",""
"Phasentyp-Verteilungen und Matrix-analytische Methoden","article","","Universität Trier, Mathematik/Informatik, Forschungsbericht","",2004,"afrikaans","","99-15","",""
"The Electronic Colloquium on Computational Complexity (ECCC): A Digital Library in Use","article","","Universität Trier, Mathematik/Informatik, Forschungsbericht","",2018,"","","97-16","",""
"MMB '99, Messung, Modellierung und Bewertung von Rechen- und Kommunikationssystemen, 10. GI/NTG-Fachtagung, 22.-24. September 1999, Trier, Kurzbeiträge und Toolbeschreibungen","proceedings","","","","1999","","MMB (Kurzvorträge)","99-16","",""
"An Even Faster Solver for General Systems of Equations","article","","Universität Trier, Mathematik/Informatik, Forschungsbericht","",2010,"","","96-11","",""
"Inductive Counting below LOGSPACE","article","","Universität Trier, Mathematik/Informatik, Forschungsbericht","",1987,"","","94-12","",""
"Quantization for Probability Measures with Respect to the Geometric Mean Error","article","","Universität Trier, Mathematik/Informatik, Forschungsbericht","",2020,"afrikaans","","02-04","",""
"Analysis and Manipulation of Boolean Functions in Terms of Decision Graphs","article","","Universität Trier, Mathematik/Informatik, Forschungsbericht","",2012,"","","92-07","",""
"On MAPA/G/K/K Stations","article","","Universität Trier, Mathematik/Informatik, Forschungsbericht","",2010,"","","99-18","",""
"An EM Algorithm for Batch Markovian Arrival Processes and its Comparison to a Simpler Estimation Procedure","article","","Universität Trier, Mathematik/Informatik, Forschungsbericht","",2000,"","","01-14","",""
"Stable Methods for Variational Inequalities with Set Valued Monotone Operators","article","","Universität Trier, Mathematik/Informatik, Forschungsbericht","",2018,"","","97-07","",""
"Monotonous Oracle Machines","article","","Universität Trier, Mathematik/Informatik, Forschungsbericht","",1993,"italian","","95-02","",""
"On Multiparity Games for Pointer Jumping","article","","Universität Trier, Mathematik/Informatik, Forschungsbericht","",1999,"","","95-09","",""
"Interprocedural Invariants","article","","Universität Trier, Mathematik/Informatik, Forschungsbericht","",2022,"","","02-10","",""
"The Möbius Function, Variations Ranks, and Theta(n)-Bounds on the Modular Communication Complexity of the Undirected Graph Connectivity Problem","article","","Universität Trier, Mathematik/Informatik, Forschungsbericht","",2006,"","","94-04","",""
"On the Complexity of One Branching Graphs","article","","Universität Trier, Mathematik/Informatik, Forschungsbericht","",2022,"","","92-12","",""
"A Note on Möbius Functions and the Communication Complexity of the Graph-Accessability-Problem","article","","Universität Trier, Mathematik/Informatik, Forschungsbericht","",1993,"","","92-05","",""
"Lock-Keeper Technology - A New Network Security Solution","article","","Universität Trier, Mathematik/Informatik, Forschungsbericht","",2012,"","","03-05","",""
"Cascade: A Simple and Efficient Algorithm for Priority Queues","article","","Universität Trier, Mathematik/Informatik, Forschungsbericht","",2012,"french","","94-15","",""
"Efficient Boolean Manipulation with OBDD's can be Extended to FBDD's","article","","Universität Trier, Mathematik/Informatik, Forschungsbericht","",2020,"","","93-12","",""
"Case Study: Manipulating xor-OBDDs by Means of Signatures","article","","Universität Trier, Mathematik/Informatik, Forschungsbericht","",2007,"","","97-15","",""
"Exact Analysis of Closed Synchronized Systems of Stochastic Sequential Processes","article","","Universität Trier, Mathematik/Informatik, Forschungsbericht","",1989,"italian","","93-02","",""
"Operator-Geometric Solutions for the M/G/k Queue and its Variants","article","","Universität Trier, Mathematik/Informatik, Forschungsbericht","",2003,"","","00-11","",""
"A New LP-Bound in Multivariate Lipschitz Optimization: Application to Unconstrained and Linearly Constrained Problems and to Systems of Inequalities","article","","Universität Trier, Mathematik/Informatik, Forschungsbericht","",2020,"","","94-08","",""
"Complexity of Finite-Horizon Markov Decision process Problems.","article","","Universität Trier, Mathematik/Informatik, Forschungsbericht","",2016,"","","99-25","",""
"The Graph of Integer Multiplication is Hard for Read-k-Times Networks","article","","Universität Trier, Mathematik/Informatik, Forschungsbericht","",2021,"","","95-10","",""
"Two short notes","article","","Universität Trier, Mathematik/Informatik, Forschungsbericht","",1994,"","","01-18","",""
"On Smoothing of Generalized max-Functions via epsilon-Regularization","article","","Universität Trier, Mathematik/Informatik, Forschungsbericht","",2005,"","","96-14","",""
"An Adequate Reducibility Concept for Problems Defined in Terms of Ordered Binary Decision Diagrams","article","","Universität Trier, Mathematik/Informatik, Forschungsbericht","",2014,"","","96-02","",""
"On Continuous Deformations of Semi-Infinite Optimization Problems","article","","Universität Trier, Mathematik/Informatik, Forschungsbericht","",2020,"italian","","94-02","",""
"Accelerating OBDD-Minimization by Means of Structural and Semantical Properties","article","","Universität Trier, Mathematik/Informatik, Forschungsbericht","",2021,"french","","98-25","",""
"Distributed Script - A Mobile Application for Multi-hop Ad-hoc Networks","article","","Universität Trier, Mathematik/Informatik, Forschungsbericht","",2022,"french","","06-02","",""
"On the Expressiveness of Tree Set Operators","article","","Universität Trier, Mathematik/Informatik, Forschungsbericht","",2022,"afrikaans","","02-17","",""
"On the Joint Distribution Functions of Order Statistics with Reference to Step-up Multiple Test Procedures","article","","Universität Trier, Mathematik/Informatik, Forschungsbericht","",2016,"","","93-19","",""
"Ordered Binary Decision Diagrams and Their Significance in Computer-Aided Design of VLSI Circuits","article","","Universität Trier, Mathematik/Informatik, Forschungsbericht","",2009,"spanish","","98-01","",""
"Polynomial Constants are Decidable","article","","Universität Trier, Mathematik/Informatik, Forschungsbericht","",2012,"","","02-09","",""
"Spatial Generalization of BMAP's with Finite State Space","article","","Universität Trier, Mathematik/Informatik, Forschungsbericht","",1984,"","","98-11","",""
"On Generalized Bisection of N-Simplices","article","","Universität Trier, Mathematik/Informatik, Forschungsbericht","",1992,"","","96-06","",""
"An Integer Concave Minimization Approach for the Minimum Concave Cost Capacitated Flow Problem on Networks","article","","Universität Trier, Mathematik/Informatik, Forschungsbericht","",1987,"","","94-13","",""
"Practical PRAM Programming with Fork95 - A Tutorial","article","","Universität Trier, Mathematik/Informatik, Forschungsbericht","",2019,"","","97-12","",""
"Scheduling and Related Graph Theoretical Problems","article","","Universität Trier, Mathematik/Informatik, Forschungsbericht","",2020,"","","93-24","",""
"Computational Convexity","article","","Universität Trier, Mathematik/Informatik, Forschungsbericht","",2017,"","","96-25","",""
"Convergence of Disturbed Martingales and a Stochastic Model for Annuity Funds","article","","Universität Trier, Mathematik/Informatik, Forschungsbericht","",2006,"","","99-08","","http://www.mathematik.uni-trier.de/preprints/About/FoMaInf_08.html"
"Approximation Algorithms for Register Allocation","article","","Universität Trier, Mathematik/Informatik, Forschungsbericht","",2018,"","","96-13","",""
"The Theory of Optimal Sampling in Continuous Time","article","","Universität Trier, Mathematik/Informatik, Forschungsbericht","",2016,"","","97-25","",""
"Lower Bounds for Randomized Branching Programs with a Big OBDD Part","article","","Universität Trier, Mathematik/Informatik, Forschungsbericht","",2007,"","","00-13","",""
"Inexact SQP Interior Point Methods and Large Scale Optimal Control Problems","article","","Universität Trier, Mathematik/Informatik, Forschungsbericht","",2000,"","","96-09","",""
"Applying Formal Verification with Protocol Compiler","article","","Universität Trier, Mathematik/Informatik, Forschungsbericht","",2005,"spanish","","99-29","",""
"On Regularisation of Nonconvex Problems","article","","Universität Trier, Mathematik/Informatik, Forschungsbericht","",1985,"","","01-17","",""
"Finite Limits and Lower Bounds for Circuits Size","article","","Universität Trier, Mathematik/Informatik, Forschungsbericht","",2005,"","","94-06","",""
"On Alternating vs. Parity Communication Complexity","article","","Universität Trier, Mathematik/Informatik, Forschungsbericht","",2009,"","","98-20","",""
"Quantization for Probability Measures in the Prohorov Metric","article","","Universität Trier, Mathematik/Informatik, Forschungsbericht","",2022,"","","02-03","",""
"Fast and Simple Nested Fixpoints","article","","Universität Trier, Mathematik/Informatik, Forschungsbericht","",2012,"","","96-05","",""
"Xor-OBDDs - a BDD Structure for Probabilistic Verification","article","","Universität Trier, Mathematik/Informatik, Forschungsbericht","",2006,"","","98-28","",""
"Polytopes in Combinatorial Optimization","article","","Universität Trier, Mathematik/Informatik, Forschungsbericht","",2003,"","","96-08","",""
"Medizinische Bildverarbeitung - eine Übersicht","article","","Universität Trier, Mathematik/Informatik, Forschungsbericht","",2009,"","","04-03","",""
"Local Convergence of the Symmetric Rank-One Iteration","article","","Universität Trier, Mathematik/Informatik, Forschungsbericht","",2015,"","","95-07","",""
"Expressing Uniformity via Oracles","article","","Universität Trier, Mathematik/Informatik, Forschungsbericht","",2020,"","","95-01","",""
"Computational Design of Stabilizing Static Output Feedback Controllers","article","","Universität Trier, Mathematik/Informatik, Forschungsbericht","",1973,"","","99-01","",""
"A Piecewise-Deterministic Model for Brownian Motion","article","","Universität Trier, Mathematik/Informatik, Forschungsbericht","",2002,"","","02-06","",""
"Design and Implementation of a PHP-based Web Server for the Tele-Lab IT Security","article","","Universität Trier, Mathematik/Informatik, Forschungsbericht","",2019,"","","03-06","",""
"On the GI/G/k Queue with Lebesgue-Dominated Inter-Arrival Time Distribution","article","","Universität Trier, Mathematik/Informatik, Forschungsbericht","",2010,"english","","01-10","",""
"A Phase Space Model for Spatial BMAPs","article","","Universität Trier, Mathematik/Informatik, Forschungsbericht","",2018,"english","","98-15","",""
"Binary Decision Diagrams and the Multiple Variable Order Problem","article","","Universität Trier, Mathematik/Informatik, Forschungsbericht","",2021,"","","98-22","",""
"A New Proof of the Beckenbach Inequalities","article","","Universität Trier, Mathematik/Informatik, Forschungsbericht","",1980,"","","03-02","",""
"Primal-Dual Contraint Aggregation Method in Multistage Stochastic Programming","article","","Universität Trier, Mathematik/Informatik, Forschungsbericht","",2013,"italian","","97-26","",""
"A Pre-Dual for the Convolution Algebra D'(Gamma+)","article","","Universität Trier, Mathematik/Informatik, Forschungsbericht","",2001,"","","93-13","",""
"An Optimization Algorithm for the MAP/PH/K Queue with Heterogeneous Servers","article","","Universität Trier, Mathematik/Informatik, Forschungsbericht","",2008,"afrikaans","","02-11","",""
"Propositional Proofs and Their Complexity","article","","Universität Trier, Mathematik/Informatik, Forschungsbericht","",2019,"english","","99-21","",""
"Nonapproximability Results for Partially Observable Markov Decision Processes","article","","Universität Trier, Mathematik/Informatik, Forschungsbericht","",2011,"","","00-12","",""
"Spatial Queues with Infinitely Many Servers","article","","Universität Trier, Mathematik/Informatik, Forschungsbericht","",1995,"","","99-04","",""
"Method for Global Optimization of Class of Nonlinear Bilevel Programming Problems","article","","Universität Trier, Mathematik/Informatik, Forschungsbericht","",1993,"","","02-14","",""
"Local Encoding Transformations for Optimizing OBDD-Representations of Finite State Machines","article","","Universität Trier, Mathematik/Informatik, Forschungsbericht","",2016,"french","","96-23","",""
"A new Algorithm for Solving the General Quadratic Programming Problem","article","","Universität Trier, Mathematik/Informatik, Forschungsbericht","",2002,"french","","93-22","",""
"Dual Characterization of Super-Hedging Prices in a Currency Market with Proportional Transaction Costs","article","","Universität Trier, Mathematik/Informatik, Forschungsbericht","",2012,"","","99-24","",""
"Die Entwicklung der Informatik braucht Theorie und Praxis: Ein Fallbeispiel aus dem CAD-Schaltkreisentwurf","article","","Universität Trier, Mathematik/Informatik, Forschungsbericht","",2021,"","","95-21","",""
"Simultaneous Pseudo-Timestepping for Aerodynamic Shape Optimization Problems with State Constraints","article","","Universität Trier, Mathematik/Informatik, Forschungsbericht","",2011,"","","04-06","",""
"Combinational Logic Verification with FBDDs","article","","Universität Trier, Mathematik/Informatik, Forschungsbericht","",2019,"afrikaans","","93-08","",""
"Speeding Up Symbolic Model Checking by Accelerating Dynamic Variable Reordering","article","","Universität Trier, Mathematik/Informatik, Forschungsbericht","",1990,"","","99-28","",""
"Probabilistic Verification of Multiple-Valued Functions","article","","Universität Trier, Mathematik/Informatik, Forschungsbericht","",2013,"","","99-23","",""
"From Markov Jump Processes to Inhomogeneous BMAPs","article","","Universität Trier, Mathematik/Informatik, Forschungsbericht","",1994,"","","02-01","",""
"The Structure Theorem for Linear Transfer Systems","article","","Universität Trier, Mathematik/Informatik, Forschungsbericht","",2018,"","","92-02","",""
"Proximal Point Methods in Examples","article","","Universität Trier, Mathematik/Informatik, Forschungsbericht","",2020,"english","","96-20","",""
"ForkLight: A Control-Synchronous Parallel Programming Language","article","","Universität Trier, Mathematik/Informatik, Forschungsbericht","",2005,"","","98-13","",""
"Improving XOR-Node Placement for (+)-OBDDs","article","","Universität Trier, Mathematik/Informatik, Forschungsbericht","",2011,"afrikaans","","01-07","",""
"Boolean Manipulation with Free BDD's - First Experimental Results","article","","Universität Trier, Mathematik/Informatik, Forschungsbericht","",2018,"","","93-20","",""
"Separation by Hyperplanes in Finite-Dimensional Vector Spaces Over Archimedean Ordered Fields","article","","Universität Trier, Mathematik/Informatik, Forschungsbericht","",2017,"spanish","","97-02","",""
"Successive Determination and Verification of Polytopes by their X-Rays","article","","Universität Trier, Mathematik/Informatik, Forschungsbericht","",2019,"italian","","92-03","",""
"On the Power of Polynomial Bit-Reductions","article","","Universität Trier, Mathematik/Informatik, Forschungsbericht","",2022,"","","92-28","",""
"Cross-Positive Matrices Revisited","article","","Universität Trier, Mathematik/Informatik, Forschungsbericht","",2020,"","","93-17","",""
"Vom M/G/1- zum BMAP/G/1-Modell","article","","Universität Trier, Mathematik/Informatik, Forschungsbericht","",2017,"","","02-18","",""
"Precise Interprocedural Dependence Analysis of Parallel Programs","article","","Universität Trier, Mathematik/Informatik, Forschungsbericht","",2014,"","","02-08","",""
"The Disjoint Cliques Problem","article","","Universität Trier, Mathematik/Informatik, Forschungsbericht","",2019,"","","92-23","",""
"Stability Conditions for the BMAP/G/1 Queue with Level Dependent Arrivals","article","","Universität Trier, Mathematik/Informatik, Forschungsbericht","",2002,"","","98-18","",""
"On the Complexity of a Licence Constrained Job Assignment Problem","article","","Universität Trier, Mathematik/Informatik, Forschungsbericht","",2022,"","","92-15","",""
"Differences in productivity and impact across the different computer science subareas.","article","Institute of Computing, University of Campinas, Campinas, Brazil","Technical Report","",2018,"french","","IC-12-08","","http://www.ic.unicamp.br/~reltech/2012/12-08.pdf"
"The 1995 SQL Reunion: People, Project, and Politics, May 29, 1995.","article","","Digital System Research Center Report","","1997","english","","SRC1997-018","","http://www.mcjones.org/System_R/SQL_Reunion_95/"
"The Future of Classic Data Administration: Objects + Databases + CASE","inproceedings","","","",2015,"","SWEE","","","http://www.mitre.org/support/swee/rosenthal.html"
"Normalized Data Base Structure: A Brief Tutorial.","article","","Research Report / RJ / IBM / San Jose, California","November",2017,"","","RJ935","",""
"Seven Steps to Rendezvous with the Casual User.","inproceedings","","","January",2010,"","IFIP Working Conference Data Base Management","","179-200",""
"Relational Completeness of Data Base Sublanguages.","article","","Research Report / RJ / IBM / San Jose, California","March",2006,"","","RJ987","",""
"DB&LP: A WWW Bibliography on Databases and Logic Programming","article","","Compulog Newsletter","",2016,"","","","",""
"Interactive Support for Non-Programmers: The Relational and Network Approaches.","article","","Research Report / RJ / IBM / San Jose, California","June",2013,"","","RJ1400","",""
"Data Base Sublanguage Founded on the Relational Calculus.","article","","Research Report / RJ / IBM / San Jose, California","July",2010,"","","RJ893","",""
"Catchment classification by runoff behaviour with self-organizing maps (SOM)","article","","Hydrology and Earth System Sciences","",2022,"french","","15","2947-2962","https://doi.org/10.5194/hess-15-2947-2011"
"Lions' Commentary on UNIX 6th Edition, with Source Code","book","Peer-to-Peer Communications","","",1990,"","","","","https://www.wikidata.org/entity/Q493858"
"Common Subexpression Identification in General Algebraic Systems.","article","","Technical Rep. UKSC 0060, IBM United Kingdom Scientific Centre","November",2022,"","","","",""
"Further Normalization of the Data Base Relational Model.","article","","Research Report / RJ / IBM / San Jose, California","August",2021,"","","RJ909","",""
"Derivability, Redundancy and Consistency of Relations Stored in Large Data Banks.","article","","Research Report / RJ / IBM / San Jose, California","August",2019,"","","RJ599","",""
"Principles of Distributed Object Database Languages.","article","","ETH Zurich, Department of Computer Science / Technical Report","July",2010,"","","248","1-27","https://doi.org/10.3929/ethz-a-006651652"
"The Capabilities of Relational Database Management Systems.","article","","Research Report / RJ / IBM / San Jose, California","May",2001,"","","RJ3132","",""
"Analysis of projected hydrological behavior of catchments based on signature indices","article","","Hydrology and Earth System Sciences","",2020,"english","","16","409-421","https://doi.org/10.5194/hess-16-409-2012"
"Portierung des DBLP-Systems auf ein relationales Datenbanksystem und Evaluation der Performance.","mastersthesis","","","",2019,"","","","","http://dbis.uni-trier.de/Diplomanden/Vollmer/vollmer.shtml"
"Who's Who in the World Wide Web: Approaches to Name Disambiguation","mastersthesis","","","",2009,"","","","","http://www.pms.ifi.lmu.de/publikationen/diplomarbeiten/Vanessa.Klaas/thesis.pdf"
"PRPL: A Database Workload Specification Language, v1.3.","mastersthesis","","","",2011,"english","","","",""
"Efficient View Maintenance at Data Warehouses.","mastersthesis","","","",1997,"","","","",""
"Der Einfluss kleiner naturnaher Retentionsmaßnahmen in der Fläche auf den Hochwasserabfluss - Kleinrückhaltebecken -.","mastersthesis","","","",1994,"","","","","http://dblp.uni-trier.de/papers/DiplomarbeitRitaLey.pdf"
"Regelbasierte Extraktion und asymmetrische Fusion bibliographischer Informationen.","mastersthesis","","","",2020,"","","","","http://dblp.uni-trier.de/papers/DiplomarbeitOliverHoffmann.pdf"
"Ear Shape for Biometric Identification.","incollection","","","",2003,"","Encyclopedia of Cryptography and Security (2nd Ed.)","","372-378","https://doi.org/10.1007/978-1-4419-5906-5_738"
"ARP Poisoning.","incollection","","","","2011","italian","Encyclopedia of Cryptography and Security (2nd Ed.)","","47","https://doi.org/10.1007/978-1-4419-5906-5_1000"
"Token.","incollection","","","",2017,"","Encyclopedia of Cryptography and Security (2nd Ed.)","","1305-1306","https://doi.org/10.1007/978-1-4419-5906-5_309"
"Multi-Threaded Implementation for Cryptography and Cryptanalysis.","incollection","","","",2021,"","Encyclopedia of Cryptography and Security (2nd Ed.)","","823-824","https://doi.org/10.1007/978-1-4419-5906-5_439"
"Privacy-Preserving Authentication in Wireless Access Networks.","incollection","","","",2019,"","Encyclopedia of Cryptography and Security (2nd Ed.)","","972-974","https://doi.org/10.1007/978-1-4419-5906-5_51"
"Issuer.","incollection","","","",2015,"","Encyclopedia of Cryptography and Security (2nd Ed.)","","650","https://doi.org/10.1007/978-1-4419-5906-5_290"
"Malware.","incollection","","","","2011","","Encyclopedia of Cryptography and Security (2nd Ed.)","","750","https://doi.org/10.1007/978-1-4419-5906-5_1320"
"Private Key Cryptosystem.","incollection","","","","2011","","Encyclopedia of Cryptography and Security (2nd Ed.)","","976","https://doi.org/10.1007/978-1-4419-5906-5_1139"
"Multicast Stream Authentication.","incollection","","","","2011","","Encyclopedia of Cryptography and Security (2nd Ed.)","","808","https://doi.org/10.1007/978-1-4419-5906-5_1099"
"Personal Identification Number (PIN).","incollection","","","",2022,"","Encyclopedia of Cryptography and Security","","","https://doi.org/10.1007/0-387-23483-7_299"
"Differential-Linear Attack.","incollection","","","",2015,"afrikaans","Encyclopedia of Cryptography and Security","","","https://doi.org/10.1007/0-387-23483-7_109"
"Existential Forgery.","incollection","","","",1982,"","Encyclopedia of Cryptography and Security (2nd Ed.)","","433-434","https://doi.org/10.1007/978-1-4419-5906-5_202"
"Entropy Sources.","incollection","","","",1998,"","Encyclopedia of Cryptography and Security (2nd Ed.)","","421-423","https://doi.org/10.1007/978-1-4419-5906-5_201"
"Inversion in Galois Fields.","incollection","","","","2011","","Encyclopedia of Cryptography and Security (2nd Ed.)","","632","https://doi.org/10.1007/978-1-4419-5906-5_1102"
